property_type|rent_type|location,price,n_rooms,n_bath,surface,details,url,metrocuadrado_index
"Apartamento en Arriendo, LAS ACACIAS Bogotá D.C..",$2.000.000,1,2,50.0 m2,"Lindo apartamento de 1 alcoba, interior pero con entrada de sol y excelente luz natural,  muy buen estado, amoblado, con dotación completa , precio negociable, estrategicamente ubicado, caminando cerca a zonas de restaurantes y supermercados. Admirelo  ",https://www.metrocuadrado.com/inmueble/arriendo-apartamento-bogota-las-acacias-1-habitaciones-2-banos-2-garajes/462-M2201687,54.9
"Apartamento en Arriendo, INGEMAR Bogotá D.C..",$2.435.000,1,2,60.0 m2,"Espectacular apartamento  Amoblado Ubicado en el castillo, con excelente vista, exterior, cuenta con 1 amplia habitación, 1 cocina, zona de ropas independiente, biblioteca, chimenea balcón, y 1 parqueadero. valor canon sin amoblar 2 .300.000 admon incluida  ",https://www.metrocuadrado.com/inmueble/arriendo-apartamento-bogota-ingemar-1-habitaciones-2-banos-1-garajes/225-M2201247,51.7
"Apartamento en Arriendo, CHICO NORTE Bogotá D.C..",$2.350.000,1,1,40.0 m2,"Arrendamos apartaestudio amoblado en Chico Reservado. Cuenta con 40m2 más 15m2 de terraza privada, cocina abierta con todos los electrodomésticos y menaje, 1 habitación, 1 baño, 1 garaje y 1 depósito pequeño. El valor del canon incluye directv e internet. Ubicado en un sector estratégico, vecino a restaurantes, notarías, bancos y parques.",https://www.metrocuadrado.com/inmueble/arriendo-apartamento-bogota-chico-norte-1-habitaciones-1-banos-1-garajes/220-170,69.1
"Apartamento en Arriendo, SANTA BARBARA OCCIDENTAL Bogotá D.C..",$2.340.000,1,1,45.0 m2,"MLS #18-480

Arriendo Apartaestudio amoblado totalmente listo para mudarse, excelente zona residencial, muy acogedor y luminoso, amplios espacios de almacenamiento, decoracion moderna, cocina independiente, hermosos pisos recien instalados de WPC-Bambu muy resistentes, salon comunal, CCTV.",https://www.metrocuadrado.com/inmueble/arriendo-apartamento-bogota-santa-barbara-occidental-1-habitaciones-1-banos-1-garajes/691-M2199879,89.3
"Apartamento en Arriendo, MOLINOS NORTE Bogotá D.C..",$2.830.000,1,2,60.0 m2,"MLS #18-473

Arriendo Apartaestudio amoblado, totalmente equipado listo para mudarse, muy amplio y con una hermosa decoracion moderna, habiatcion con vestier. Ubicado en excelente zona ,edificio nuevo",https://www.metrocuadrado.com/inmueble/arriendo-apartamento-bogota-molinos-norte-1-habitaciones-2-banos-1-garajes/691-M2200061,52.1
"Apartamento en Arriendo, CHICO NORTE Bogotá D.C..",$3.600.000,1,1,50.0 m2,"Lindo apartamento para arriendo amoblado en Chico Norte de 50 m2 . Una alcoba con baño, sala comedor con chimenea. Cocina cerrada. Un garaje. El valor del canon incluye la administración.",https://www.metrocuadrado.com/inmueble/arriendo-apartamento-bogota-chico-norte-1-habitaciones-1-banos-1-garajes/920-42148930,81.2
"Apartamento en Arriendo, SANTA BARBARA OCCIDENTAL Bogotá D.C..",$2.500.000,1,1,40.0 m2,"CÓMODO Y ACOGEDOR APARTAMENTO AMOBLADO EN ARRIENDO, MUY BIEN UBICADO CERCA A LA AUTOPISTA CON 40M2,  CUENTA CON TERRAZA 25M2,  UNA ALCOBA, BAÑO, COCINA A GAS CON HORNO, ZONA DE LAVANDERÍA, SALA  COMEDOR, GARAJE, PARQUEADERO DE VISITANTES Y VIGILANCIA LAS 24 HORAS.  EL PAGO INCLUYE LUZ, AGUA Y GAS.",https://www.metrocuadrado.com/inmueble/arriendo-apartamento-bogota-santa-barbara-occidental-1-habitaciones-1-banos-1-garajes/22-M2196811,60.5
"Apartamento en Arriendo, SAN PATRICIO Bogotá D.C..",$2.500.000,1,2,58.0 m2,"Hermoso aparta estudio completamente amoblado y dotado, ideal para ejecutivo joven. Excelente ubicación. Una habitación, 2 baños, 1 parqueadero, chimenea, pisos en madera y alfombra, gas natural en estufa, cocina abierta, sala comedor, caldera. Informes Martha Cecilia Cobo G. ",https://www.metrocuadrado.com/inmueble/arriendo-apartamento-bogota-san-patricio-1-habitaciones-2-banos-1-garajes/3065-M2194967,50.2
"Apartamento en Arriendo, LA PORCIUNCULA Bogotá D.C..",$2.100.000,1,1,50.0 m2,"Apartamento recién remodelado y AMOBLADO, 1 cuarto (con estudio), 1 baño, sala-comedor y cocina integrada, con 1 parqueadero. Tiene además mucho espacio de closet, así que funciona muy bien para parejas. 
Queda a un par de cuadras de la Zona G y Zona financiera y la calle 75 (donde esta ubicado) es super tranquila. Lamina de madera en la sala, baldosa en la cocina y tapete en el cuarto.",https://www.metrocuadrado.com/inmueble/arriendo-apartamento-bogota-la-porciuncula-1-habitaciones-1-banos-1-garajes/840-M2193794,72.2
"Apartamento en Arriendo, SANTA BARBARA OCCIDENTAL Bogotá D.C..",$2.500.000,1,2,60.0 m2,"Excelente apartamento amoblado para arriendo muy cerca a Unicentro de 60 m2 remodelado. Una alcoba, dos baños, sala comedor con chimenea, cocina abierta y zona de lavandería. Edificio con gimnasio y sauna. Estratégicamente ubicado cerca a centros comerciales e importantes ejes viales.",https://www.metrocuadrado.com/inmueble/arriendo-apartamento-bogota-santa-barbara-occidental-1-habitaciones-2-banos-1-garajes/920-42148880,39.7
"Apartamento en Venta Y Arriendo, SANTA BARBARA CENTRAL Bogotá D.C..",$2.500.000,1,1,48.0 m2,"Excelente aparta estudio amoblado para estrenar tipo loft, ubicado en el quinto piso con 48.75 metros con vista interior y excelente iluminación natural pisos  en madera laminada cocina abierta tipo loft  y calentador a gas un baño dos garajes cubiertos  8,9  un depósito, El edificio cuenta con ascensor, citófono, CCTV, portería, recepción y vigilancia 24 horas, planta eléctrica, terraza  vista panorámica , salón comunal y jaula de golf. Ubicado cerca a centros comerciales.",https://www.metrocuadrado.com/inmueble/venta-apartamento-bogota-santa-barbara-central-1-habitaciones-1-banos-2-garajes/342-10980,52.2
"Apartamento en Arriendo, LAS ACACIAS Bogotá D.C..",$2.000.000,1,2,50.0 m2,"Lindo apartamento de 1 alcoba, interior pero con entrada de sol y excelente luz natural,  muy buen estado, amoblado, con dotación completa , precio negociable, estrategicamente ubicado, caminando cerca a zonas de restaurantes y supermercados. Admirelo  ",https://www.metrocuadrado.com/inmueble/arriendo-apartamento-bogota-las-acacias-1-habitaciones-2-banos-2-garajes/462-M2192641,73.6
"Apartamento en Arriendo, LAS AGUAS Bogotá D.C..",$1.500.000,1,1,35.0 m2,"Hermoso Apartamento En arriendo en las aguas la mejor ubicación en el centro de la cuidad, en zona universitaria Andes, Tadeo y zona de turismo  remodelado, completamente amoblado.",https://www.metrocuadrado.com/inmueble/arriendo-apartamento-bogota-las-aguas-1-habitaciones-1-banos/634-M2174160,61.7
"Apartamento en Arriendo, LAS ACACIAS Bogotá D.C..",$4.000.000,1,1,60.0 m2,"Apartamento amoblado en Rosales. Se entrega con todos los muebles. 1 habitación amplia, walk in closet y 1 baño. Totalmente remodelado. Amplia terraza. 1 parqueadero. Calefacción integrada.",https://www.metrocuadrado.com/inmueble/arriendo-apartamento-bogota-las-acacias-1-habitaciones-1-banos-1-garajes/2671-5977,75.4
"Apartamento en Arriendo, ANTIGUO COUNTRY Bogotá D.C..",$3.500.000,1,2,50.0 m2,"HERMOSO APARTAMENTO AMOBLADO EN ARRIENDO 50M2, UBICADO EN EL VIRREY, CON BALCON, UNA ALCOBA,  DOS BAÑOS, COCINA, SALA  COMEDOR,  CHIMENEA, ZONA DE LAVANDERÍA, PATIO,  CUARTO DE SERVICIO, DEPOSITO, EL EDIFICIO DISPONE DE PARQUEADERO DE VISITANTES, ASCENSOR, SALÓN COMUNAL Y VIGILANCIA LAS 24 HORAS DEL DÍA.",https://www.metrocuadrado.com/inmueble/arriendo-apartamento-bogota-antiguo-country-1-habitaciones-2-banos/22-M2164005,86.2
"Apartamento en Venta Y Arriendo, LA CAROLINA Bogotá D.C..",$2.100.000,1,1,59.19 m2,"Qué tal este lindo apartamento de una habitación y terraza al lado de Unicentro?
Aquí encontrarás muy buenos espacios, acabados  y las áreas que necesitas para vivir tranquilo y en un lugar lindo de Bogotá .
 Terraza de 22.80 mt2, sala y habitación con vista a la terraza, cocina  semiabierta , un baño enorme. La distribución y aprovechamiento del espacio dan la sensación de amplitud.
Se vende o arrienda amoblado. Arriendo amoblado $2.300.000 con la administración.
El valor publicado de arriendo incluye administración .
",https://www.metrocuadrado.com/inmueble/venta-apartamento-bogota-la-carolina-1-habitaciones-1-banos-1-garajes/4545-M2170047,62.6
"Apartamento en Arriendo, LA PORCIUNCULA Bogotá D.C..",$1.990.000,1,1,37.32 m2,"Apartaestudio amoblado en el mejor sitio del norte de Bogotá, ideal para ejecutivos, estudiantes universitarios, parejas jóvenes. Consta de una alcoba con closet, baño privado, salón comedor, estudio, cocina integral, zona de lavandería independiente. Totalmente amoblado y decorado, cama doble, televisor, sala, sofácama, mesa de comedor integrada al espacio escritorio y silla nevera, horno microondas, cafetera, menaje básico de cocina lavadora. Cctv, servicios internet, parqueadero cubie",https://www.metrocuadrado.com/inmueble/arriendo-apartamento-bogota-la-porciuncula-1-habitaciones-1-banos-1-garajes/34-59580,71.4
"Apartamento en Arriendo, CHICO NORTE III Bogotá D.C..",$2.200.000,1,2,50.0 m2,"Edificio de 10 años, interior  con buena luz y completamente remodelado. Cuenta seguridad 24 horas y parqueadero de visitantes.
",https://www.metrocuadrado.com/inmueble/arriendo-apartamento-bogota-chico-norte-iii-1-habitaciones-2-banos-1-garajes/3390-M2170585,62.1
"Apartamento en Arriendo, CANTALEJO Bogotá D.C..",$1.200.000,1,2,50.0 m2,"HERMOSO APARTAMENTO PARA ESTRENAR DE 50 METROS CUADRADOS, DISTRIBUIDO EN SALA COMEDOR, COCINA INTEGRAL A GAS ABIERTA, UNA ALCOBA,  DOS BAÑOS, BALCÓN, ZONA DE LAVANDERÍA, UN GARAJE CUBIERTO, EL CONJUNTO CUENTA CON GIMNASIO, TERRAZA, BBQ, PARQUE  INFANTIL, SALÓN SOCIAL Y AMPLIAS ZONAS VERDES.",https://www.metrocuadrado.com/inmueble/arriendo-apartamento-bogota-cantalejo-1-habitaciones-2-banos-1-garajes/4058-M2169931,33.4
"Apartamento en Arriendo, SANTA BIBIANA Bogotá D.C..",$2.200.000,1,1,48.0 m2,"HERMOSO APARTAESTUDIO AMOBLADO UBICADO EN SEGUNDO PISO CON ASCENSOR, CUENTA CON COCINA INTEGRAL A GAS, ZONA D ELAVANDERIA, 1 HABITACION, 1 BAÑO, 1 PARQUEADERO CUBIERTO, PISOS EN MADERA LAMINADA, EL EDIFICIO CUENTA CON VIGILANCIA LAS 24 HORAS, SALON SOCIAL.",https://www.metrocuadrado.com/inmueble/arriendo-apartamento-bogota-santa-bibiana-1-habitaciones-1-banos-1-garajes/5031-9919,74.8
"Apartamento en Arriendo, CHICO NORTE II Bogotá D.C..",$2.300.000,1,1,60.0 m2,"Hermoso apartamento amoblado bien ubicado, remodelado, piso en madera laminada, tranquilo.
",https://www.metrocuadrado.com/inmueble/arriendo-apartamento-bogota-chico-norte-ii-1-habitaciones-1-banos-1-garajes/5166-M2159958,46.8
"Apartamento en Arriendo, ACACIAS USAQUEN Bogotá D.C..",$1.900.000,1,2,60.0 m2,"HERMOSO APARTAMENTO AMOBLADO CON 5 AÑOS DE CONSTRUIDO DE 60 METROS CUADRADOS, DISTRIBUIDO EN SALA COMEDOR, COCINA INTEGRAL A GAS ABIERTA COMPLETAMENTE EQUIPADA CON NEVERA, UNA ALCOBA, DOS BAÑOS, ZONA DE LAVANDERÍA CON LAVADORA Y SECADORA, INCLUIDO EL ASEO GENERAL CADA 15 DÍAS, UN GARAJE Y DEPOSITO, EL CONJUNTO CUENTA CON ZONAS VERDES, SALÓN SOCIAL. BBQ.",https://www.metrocuadrado.com/inmueble/arriendo-apartamento-bogota-acacias-usaquen-1-habitaciones-2-banos-1-garajes/4058-M2156652,74.6
"Apartamento en Arriendo, LA CALLEJA Bogotá D.C..",$2.300.000,1,2,54.0 m2,"Arriendo amoblado espectacular apartamento cerca a unícentro amoblado  ,54 mts , sala comedor con cocina abierta , zona de lavandería independiente, baño social, alcoba con baño privado ,Woking closet, pisos en madera, edificio moderno con una terraza con bbq. Arriendo 3100 incluida la Administración.Contacto liliana Zarate",https://www.metrocuadrado.com/inmueble/arriendo-apartamento-bogota-la-calleja-1-habitaciones-2-banos-1-garajes/2328-M2154045,61.8
"Apartamento en Arriendo, CHICO Bogotá D.C..",$3.200.000,1,2,60.0 m2,"Espectacular apartamento pido 6, iluminado, excelente sector rodeado de restaurantes, zona bancaria, avenidas principales cra 11 , cra 15 , cra 7, cra 9, cerca parque virrey, vista panorámica. Alcoba 1,Sala comedor chimenea, Baño social, Baño alcoba principal, 2 garajes en línea, Cocina abierta y Zona de ropas independiente.


",https://www.metrocuadrado.com/inmueble/arriendo-apartamento-bogota-chico-1-habitaciones-2-banos-2-garajes/5430-M2157947,63.1
"Apartamento en Arriendo, MONACO Bogotá D.C..",$1.900.000,1,1,46.0 m2,"ALCOBA PRINCIPAL, SALACOMEDOR, COCINA, BANO, ENTREGA INMEDIATA, AMOBLADO, UNIFAMILIAR, EDIFICIO, CITOFONIA, CONJUNTO CERRADO, INTERIOR , CORTINAS, PISO NÂ  uno, LAMPARAS, REFORMADO(A), SEGURIDAD PRIVADA, CLOSET DE LINOS uno, ESTANDAR, TIPO COCINA INTEGRAL, TIPO CALENTADOR GAS NATURAL, SUMINISTRO DE GAS RED, ESTUFA GAS NATURAL",https://www.metrocuadrado.com/inmueble/arriendo-apartamento-bogota-monaco-1-habitaciones-1-banos/2-44835,64.2
"Apartamento en Arriendo, CEDRITOS Bogotá D.C..",$1.450.000,1,1,50.0 m2,"APARTAMENTO AMOBLADO DE 50 METROS CUADRADOS, DISTRIBUIDO EN SALA COMEDOR, COCINA INTEGRAL A GAS, UNA ALCOBA, UN BAÑO, UN GARAJE CUBIERTO, CERCA A LA CALLE 140 CON 12.",https://www.metrocuadrado.com/inmueble/arriendo-apartamento-bogota-cedritos-1-habitaciones-1-banos-1-garajes/4058-M2150495,52.2
"Apartamento en Arriendo, CHICO Bogotá D.C..",$3.500.000,1,2,53.0 m2,"Se arrienda espectacular apartamento AMOBLADO con un área de 53 metros , cuenta con dos grandes, 1 alcoba con  vestier , sala, comedor , cocina con lava vajillas , 2 garajes,   edificio moderno con piscina , sala de juntas, garaje de visitantes, cancha de squash ,terraza comunal, zona de BBQ , Parque infantil, salón comunal. C&C 07-07-2018",https://www.metrocuadrado.com/inmueble/arriendo-apartamento-bogota-chico-1-habitaciones-2-banos-2-garajes/800-M2143077,76.9
"Apartamento en Arriendo, PLENITUD Bogotá D.C..",$2.800.000,1,1,48.0 m2,"Excelente apartamento amoblado para arriendo, ubicado en muy buen sector de La Carolina, continuo a hotel la fontana, amplios espacios, luz natural, a tan solo unas cuadras de parques, centro comercial y vías principales, 1 habitación, 1 baño, sala, comedor, cocina integral, zona de lavandería, 1 garaje. Edificio con Gimnasio, parque para niños, capilla, zonas verdes, restaurante, café Colombia. Valor incluidos servicios y administración.",https://www.metrocuadrado.com/inmueble/arriendo-apartamento-bogota-plenitud-1-habitaciones-1-banos-1-garajes/438-M2145266,76.4
"Apartamento en Arriendo, CHICO NORTE Bogotá D.C..",$2.415.000,1,1,40.0 m2,"Cod. 1 CM A Excelente apartamento de 1 habitación con terraza, sala  comedor, Cocina Integral, Zona de Lavandería, el inmueble se arrienda amoblado e incluyendo Internet banda ancha, telefonía y televisión por cable. Adicional, cuenta con un sofá cama, 1 parqueadero y 1 deposito. Excelente ubicación.",https://www.metrocuadrado.com/inmueble/arriendo-apartamento-bogota-chico-norte-1-habitaciones-1-banos-1-garajes/5325-801,67.9
"Apartamento en Arriendo, CHICO NORTE II Bogotá D.C..",$2.100.000,1,1,57.0 m2,"HERMOSO APARTAMENTO AMOBLADO  DE 57 M2 EN CHICO RESERVADO, CUENTA CON UNA ALCOBA, UN BAÑO, SALA-COMEDOR, UN GARAJE Y  DEPOSITO.",https://www.metrocuadrado.com/inmueble/arriendo-apartamento-bogota-chico-norte-ii-1-habitaciones-1-banos-1-garajes/22-M2132872,59.3
"Apartamento en Arriendo, CHICO NORTE III Bogotá D.C..",$2.200.000,1,1,42.0 m2,"Espectcular apartaestudio ubicado en la 94 con 16,  5to piso exterior, 36 metros, totalmente remodelado, excelentes acabados, una habitación, un baño, cocina abierta, vidrios anti ruido, puerta de seguridad,  muy buena iluminación y vista!  Se arrienda amoblado.",https://www.metrocuadrado.com/inmueble/arriendo-apartamento-bogota-chico-norte-iii-1-habitaciones-1-banos/5303-M2122417,64.2
"Apartamento en Arriendo, SAMPER Bogotá D.C..",$2.500.000,1,1,38.0 m2,"Hermosos aparta estudio tipo loft, AMOBLADO, estufa de inducción, calentador eléctrico, pisos en madera laminad,a vista a la ciudad, club house con piscina, sauna, salón social  y gimnasio, cancha de squash, parqueadero para visitantes, cerca a la avenida 7, avenida caracas, calle 26 y carrera 13, parque para pasear mascotas, cafeterías, centro comercial san martin a 10 minutos.  ",https://www.metrocuadrado.com/inmueble/arriendo-apartamento-bogota-samper-1-habitaciones-1-banos/4162-M2140492,69.4
"Apartamento en Arriendo, PLENITUD Bogotá D.C..",$2.000.000,1,1,44.0 m2,"ALCOBA, SALACOMEDOR, COCINA, BANO, ZONA DE ROPAS LAVANDERIA, VESTIER, PARQUEADERO DOBLE LINEAL, SOLO VIVIENDA, ENTREGA INMEDIATA, AMOBLADO, CLOSET uno, EDIFICIO, CITOFONIA, INTERIOR , ZONAS VERDES, PISO NÂ  cinco, NIVELES uno, BLACKOUT, SIN CUARTO UTIL DEPOSITO, PERSIANAS, PORTERIA siete X veinticuatro H, ESTANDAR, TIPO COCINA INTEGRAL, ESTUFA ELECTRICA",https://www.metrocuadrado.com/inmueble/arriendo-apartamento-bogota-plenitud-1-habitaciones-1-banos-1-garajes/2-43422,73.5
"Apartamento en Arriendo, CHICO NORTE III Bogotá D.C..",$2.700.000,1,2,60.0 m2,"IT761  Apartamento amoblado , 60 mts2, 1 habitación con baño, baño social, sala comedor en un ambiente, 1 garaje.  El edificio cuenta con gimnasio, salón comunal, terraza BBQ  ",https://www.metrocuadrado.com/inmueble/arriendo-apartamento-bogota-chico-norte-iii-1-habitaciones-2-banos-1-garajes/4877-M2115817,81.3
"Apartamento en Arriendo, LA CAROLINA Bogotá D.C..",$1.780.000,1,1,50.0 m2,"HERMOSO APARTAMENTO AMOBLADO EN ARRIENDO 50M2, CON EXCELENTE  UBICACIÓN LA CAROLINA, CUENTA CON BALCÓN,  UNA ALCOBA,  BAÑO, COCINA, SALA COMEDOR, ESTUDIO, CHIMENEA, ZONA DE LAVANDERIA, GARAJE, PARQUEADERO DE VISITANTES, ASCENSOR, SALON COMUNAL, EN CONJUNTO CERRADO Y  VIGILANCIA LAS 24 HORAS DEL DÍA.",https://www.metrocuadrado.com/inmueble/arriendo-apartamento-bogota-la-carolina-1-habitaciones-1-banos-2-garajes/22-M2122676,44.1
"Apartamento en Arriendo, BOSQUE CALDERON Bogotá D.C..",$3.500.000,1,2,59.0 m2,"/Precioso Dúplex AMOBLADO, Chapinero alto, con excelente vista. Edificio de 9 años. Área 59 metros una habitación con walking closet y baño privado con jacuzzi, baño social, sala, cocina con comedor auxiliar, cocina integral, acabados en mármol y equipada con lavavajillas, zona de lavandería independiente. Cortinas con protección U.V. Un parqueadero cubierto y deposito. Edificio con vigilancia privada las 24 horas. cámaras de vigilancia. El valor incluye la administración. G.V",https://www.metrocuadrado.com/inmueble/arriendo-apartamento-bogota-bosque-calderon-1-habitaciones-2-banos-1-garajes/927-M2125318,67.6
"Apartamento en Arriendo, CHICO NORTE II Bogotá D.C..",$2.100.000,1,2,60.0 m2,"Espectacular apartamento amoblado. Viva en uno de los sectores más exclusivo de la ciudad y con ubicación privilegiada por su cercanía a todo. Restaurantes, parques, centros comerciales, entidades bancarias, notarías, papelerías y comercio en general. ",https://www.metrocuadrado.com/inmueble/arriendo-apartamento-bogota-chico-norte-ii-1-habitaciones-2-banos-1-garajes/475-M2144348,58.1
"Apartamento en Arriendo, CHICO NORTE III Bogotá D.C..",$3.000.000,1,2,54.0 m2,"Hermoso Apto bien ubicado, Piso alto - Interior,  tiene Sala – Comedor – Cocina abierta – Zona de ropas - Una alcoba separada de zona social - 2 Baños – Pisos de madera - 2 Parqueaderos en línea – Depósito
Tres años y medio de construido 

Tambien se ofrece Arriendo con Muebles 

Totalmente amoblado (Cama, colchón , sofá , 2 sillas de cocina, nevera , lavadora y secadora , 1 Tv , 1 microondas , cortinas ambos espacio y alcoba principal con black out)",https://www.metrocuadrado.com/inmueble/arriendo-apartamento-bogota-chico-norte-iii-1-habitaciones-2-banos-1-garajes/874-M2118100,66.9
"Apartamento en Venta Y Arriendo, SAN PATRICIO Bogotá D.C..",$2.200.000,1,2,58.0 m2,"Lindo Amoblado tipo loft de una alcoba para venta o arriendo. Dos baños, cocina tipo americano, chimenea, moderno, pisos en madera. Se alquila para largas estadías. También se vende sin muebles, consultar su valor",https://www.metrocuadrado.com/inmueble/venta-apartamento-bogota-san-patricio-1-habitaciones-2-banos-1-garajes/920-42148412,49.5
"Apartamento en Venta Y Arriendo, CHICO NORTE III Bogotá D.C..",$2.500.000,1,1,54.0 m2,"Hermoso Apto, en edificio Club house, Cocina abierta, 
Se vende totalmente amoblado, ideal para inversionista que necesite renta. 
También se vende sin muebles ",https://www.metrocuadrado.com/inmueble/venta-apartamento-bogota-chico-norte-iii-1-habitaciones-1-banos-1-garajes/2147-M2113611,64.3
"Apartamento en Arriendo, LAS NIEVES Bogotá D.C..",$750.000,1,1,33.0 m2,"aparta estudio remodelado en un solo habiente, vista exterior. ubicado en el centro de bogotá en sector comercial sobre la carrera décima con calle 22, Excelente para comercio de alimentos restaurante alto trafico peatonal cerca a un centros educativos como universidad INCA, y tardeo lozano, hoteles y restaurante, cadena de almacenes éxitos y ara. listo para entregar. mayor información brokersycia com",https://www.metrocuadrado.com/inmueble/arriendo-apartamento-bogota-las-nieves-1-habitaciones-1-banos/3036-M2113150,39.2
"Apartamento en Arriendo, SANTA BARBARA OCCIDENTAL Bogotá D.C..",$2.950.000,1,2,55.0 m2,"ARRIENDO APARTAMENTO AMOBLADO DE 55 M2, 1 Cuarto con baño, baño social, sala comedor con chimenea y sofá cama, cocina abierta  y zona de ropas aparte. 1 garaje y 1 depósito. Terraza comunal con gimnasio, BBQ y parque para niños. Baño turco, salón comunal y parqueaderos para visitantes. Canon $2.800.000 incluya Adm.",https://www.metrocuadrado.com/inmueble/arriendo-apartamento-bogota-santa-barbara-occidental-1-habitaciones-2-banos-1-garajes/3553-M2112050,74.8
"Apartamento en Arriendo, LAS ACACIAS Bogotá D.C..",$2.718.000,1,1,54.0 m2,"Al ingresar al apartamento encontramos un cómodo espacio para estudio, luego se abre a una amplia zona social la cual cuenta con un pequeño balcón con vista. La cocina es moderna y abierta permitiendo integrarse adecuadamente al área social.La habitación principal es bastante amplia e iluminada. El apartamento cuenta con un gran baño. Tiene Un parqueadero.",https://www.metrocuadrado.com/inmueble/arriendo-apartamento-bogota-las-acacias-1-habitaciones-1-banos-1-garajes/2671-5642,68.8
"Apartamento en Arriendo, SANTA BIBIANA Bogotá D.C..",$2.300.000,1,2,54.0 m2,"LINDO APARTAMENTO. MODERNO ILUMINADO, 1 HABITACION, 2 BAÑOS, INCLUYE NEVERA, MICROONDAS Y LAVADORA POR $2.300.000 INCLUIDO ADMINISTRACION,SE PUEDE ARRENDAR TAMBIEN AMOBLADO EN $2.600.000 INCLUIDA ADMINISTRACION,  LUCIA",https://www.metrocuadrado.com/inmueble/arriendo-apartamento-bogota-santa-bibiana-1-habitaciones-2-banos-1-garajes/2359-M2106594,70.1
"Apartamento en Arriendo, ANTIGUO COUNTRY Bogotá D.C..",$3.400.000,1,2,50.0 m2,"Amoblado, Area 50 mts, piso 2 exterior, 1 habitacion separada por un muro flotante, 2 baños, balcon pequeño, 1 parqueadero, deposito. CANON INCLUIDA LA ADMINISTRACION. APTS C-DOS",https://www.metrocuadrado.com/inmueble/arriendo-apartamento-bogota-antiguo-country-1-habitaciones-2-banos-1-garajes/2412-628069,68.8
"Apartamento en Arriendo, LA CALLEJA Bogotá D.C..",$2.649.000,1,2,50.0 m2,"Hermoso apartamento amoblado de una habitación, al ingresar nos encontramos con el área social con balcón, cocina tipo americano, baño social y zona de lavandería independiente. La alcoba cuenta con vestier y baño el suite. Tiene un parqueadero y depósito. El edificio cuenta con gimnasio y terraza comunal con dos zonas de BBQ.",https://www.metrocuadrado.com/inmueble/arriendo-apartamento-bogota-la-calleja-1-habitaciones-2-banos-1-garajes/2671-5628,66.4
"Apartamento en Arriendo, SANTA BARBARA ORIENTAL Bogotá D.C..",$1.280.000,1,1,40.0 m2,"EXCELENTE APARTA ESTUDIO DE 40M2, AMOBLADO,  1 HABITACIÓN , 1 BAÑO, SALA COMEDOR, COCINA INTEGRADA A MUEBLE,  1 GARAJE CUBIERTO, EN EDIFICIO CON ASCENSOR Y VIGILANCIA 24 HORAS, MAGNIFICA UBICACIÓN CERCA A SUPERMERCADOS, CLÍNICAS Y CENTROS COMERCIALES,  MAYOR INFORMACIÓN COMUNICARSE CON YOLANDA MANCILLA.",https://www.metrocuadrado.com/inmueble/arriendo-apartamento-bogota-santa-barbara-oriental-1-habitaciones-1-banos-1-garajes/675-M2094661,45.0
"Apartamento en Arriendo, SANTA BARBARA ORIENTAL Bogotá D.C..",$1.650.000,1,2,50.0 m2,Lateral. espacio para estudio pequeño. Baño social. Cocina cerrada. Pisos en madera natural. Con cortinas. Ubicado a 1 cuadra de la cra 7 y calle 127. Se renta con MUEBLES. ,https://www.metrocuadrado.com/inmueble/arriendo-apartamento-bogota-santa-barbara-oriental-1-habitaciones-2-banos-1-garajes/2474-M2094024,66.4
"Apartamento en Arriendo, BELALCAZAR Bogotá D.C..",$1.700.000,1,1,34.0 m2,"Magnífico apartamento amoblado de 34 m2 tipo loft en zona céntrica de la ciudad. Una habitación, un baño, cocina abierta, zona ropas, un garaje y un deposito. Terraza con bbq y salón comunal. Cerca a la Universidad Nacional, al CAD, Transmilenio y a 5 minutos del Parkway. El canon incluye administración y TV cable.",https://www.metrocuadrado.com/inmueble/arriendo-apartamento-bogota-belalcazar-1-habitaciones-1-banos-1-garajes/920-42141697,58.3
"Apartamento en Venta Y Arriendo, LAS NIEVES Bogotá D.C..",$1.300.000,1,1,40.0 m2,"SUPER APARTAMENTO, ubicado en el corazón de Bogotá con vista panorámica. Encuentre todo en un solo lugar Centro Comercial, Supermercado Carulla, y Restaurantes. Sector Empresarial, Gubernamental, Residencial y Turístico. ARRIENDO AMOBLADO $1.800.000",https://www.metrocuadrado.com/inmueble/venta-apartamento-bogota-las-nieves-1-habitaciones-1-banos-1-garajes/243-M2089564,63.6
"Apartamento en Venta Y Arriendo, CHICO NORTE III Bogotá D.C..",$2.450.000,1,1,54.0 m2,"Espectacular apartamento de un cuarto, con estudio, en edificio Club House, apartamento de oportunidad, ubicado en una de las mejores zonas de Bogotá, muy buenas vias de acceso, transporte publico y comercio. Se puede vender con los muebles que tiene en este momento.",https://www.metrocuadrado.com/inmueble/venta-apartamento-bogota-chico-norte-iii-1-habitaciones-1-banos-1-garajes/2147-M2093479,52.5
